question,answer_llm
Can antiretroviral medications affect eyesight or lead to any eye-related issues?,"Antiretroviral medications can cause eye-related side effects, including changes in vision, dry eyes, and eye infections. It is essential to report any changes in vision to a healthcare provider. Regular eye exams are recommended for people living with HIV."
Could you provide me with a counselor's contact information?,"Of course! I can provide you with a list of HIV counseling centers in your area. To get started, can you please provide me with your zip code? Additionally, I can also provide you with information on HIV testing locations, testing methods, and testing frequency recommendations."
In what ways can HIV impact a person's emotional well-being?,"HIV can impact a person's emotional well-being in several ways, including feelings of depression, anxiety, and stress due to the stigma and discrimination associated with the disease, as well as the physical and emotional burden of managing the condition. It can also lead to feelings of isolation and loneliness due to changes in social relationships and support systems. Additionally, HIV can cause cognitive impairment, which can further contribute to emotional distress."
Why is a newborn given H-treatment immediately after birth?,"Newborns are given H-treatment immediately after birth because HIV can be transmitted from mother to child during pregnancy, childbirth, or breastfeeding. H-treatment can significantly reduce the risk of mother-to-child transmission of HIV and improve the health of HIV-positive mothers and their children. The benefits of H-treatment outweigh the potential risks, and starting treatment as soon as possible after birth is important to ensure the best possible outcomes for the child and the mother."
Who are the participants in the support group?,"Support groups for people living with HIV (PLWH) are typically comprised of individuals who are HIV-positive, their friends and family members, and/or healthcare professionals. The specific composition of a support group may vary depending on the type of group (e.g., in-person, online, peer-led, professionally-led) and the needs and preferences of the participants. It is important for support groups to have clear guidelines and boundaries to ensure that the group is a safe and supportive environment for all participants."
What is the correct way to store my medication?,"The correct way to store HIV medication is in the original container, away from heat, light, and moisture. If you are traveling and need to store your medication in the refrigerator, make sure the medication is in the original container and that the temperature does not fluctuate. Always keep a record of the temperature of the refrigerator."
Is it safe to combine an herbal mixture with antiretroviral medication?,"It is generally safe to combine herbal mixtures with antiretroviral medication. However, some herbal supplements may interact with antiretroviral drugs and reduce their effectiveness. It is important to consult with a healthcare provider before taking any herbal supplements while on antiretroviral therapy."
What should I use to take my medication?,"It is recommended to use a pillbox or a pill organizer to take your medication at the correct time. If you forget to take your medication, take it as soon as you remember, but do not take it if it is close to your next scheduled dose. If you miss a dose, do not double up on your next dose."
What are the potential dangers or safety measures when mixing antiretroviral drugs with illegal substances?,"1. Mixing antiretroviral drugs with illegal substances can lead to adverse drug reactions, drug interactions, and decreased effectiveness of antiretroviral drugs. 2. It is crucial to avoid mixing antiretroviral drugs with illegal substances to maintain the effectiveness of HIV treatment and improve health outcomes. 3. If you or someone you know is using illegal substances while taking antiretroviral drugs, it is essential to seek professional help immediately to avoid potential harm."
Is it possible to contract HIV from sweat or tears?,"No, HIV cannot be transmitted through sweat or tears. HIV is only transmitted through contact with infected blood, semen, or vaginal fluids. The virus is fragile and unstable outside the body and cannot survive for long periods of time in sweat or tears."
What are the different phases of HIV infection that individuals undergo?,"The different phases of HIV infection include acute infection, latency, and progression to AIDS. Acute infection is the initial stage after an individual contracts HIV, and is characterized by a high viral load in the blood and a rapid depletion of CD4+ T cells. Latency is a period of low or undetectable viral load, during which the virus remains dormant in the body. Progression to AIDS is the final stage of HIV infection, and is characterized by a significant decline in immune function and the development of opportunistic infections."
Are my HIV medications insufficient for treating or curing malaria?,"No, your HIV medications will not affect the treatment or cure of malaria. Malaria is caused by a parasite, while HIV is caused by a virus. HIV medications target viral proteins, while malaria medications target proteins in the parasite. Therefore, HIV medications will not affect the treatment or cure of malaria, and malaria medications will not affect the treatment or cure of HIV. It is important to continue taking your HIV medications as prescribed, even if you have malaria. If you have any concerns about your medications or any other health-related questions, you should speak to your healthcare provider."
What remedies or interventions are available to address weight loss or appetite changes linked to antiretroviral (ARV) therapy?,"There are several interventions that can be used to address weight loss or appetite changes linked to antiretroviral (ARV) therapy. These include dietary counseling, nutritional supplements, and appetite stimulants. It is important to work with a healthcare provider to identify the underlying cause of the weight loss or appetite changes and to develop an appropriate treatment plan."
What does it mean to be in a discordant relationship?,"Being in a discordant relationship means that one partner is HIV-positive and the other is HIV-negative. This can refer to couples where one partner was diagnosed with HIV first and the other partner was HIV-negative, or it can refer to couples where both partners were initially HIV-negative but one partner became HIV-positive later on."
In what ways can HIV impact an individual's digestive system?,"HIV can impact the digestive system in several ways, including oral cavity, esophagus, stomach, liver, pancreas, and intestines. HIV-infected individuals may experience oral thrush, hairy leukoplakia, and other oral cavity complications. Esophageal candidiasis and pancreatitis are also common. In the stomach, HIV may cause achalasia, peptic ulcers, and gastric cancer. In the liver, HIV can cause non-Hodgkin's lymphoma, hepatitis, and liver cancer. In the intestines, HIV can cause diarrhea, malabsorption, and intestinal lymphoma."
Does having HIV impact the likelihood of developing cancer?,"HIV infection can increase the risk of developing certain cancers, such as AIDS-defining cancers (ADCs) like Kaposi sarcoma, cervical cancer, and non-Hodgkin lymphoma. However, the risk of developing these cancers has significantly decreased due to effective antiretroviral therapy (ART). HIV infection can also increase the risk of developing other types of cancer, such as lung cancer, due to factors associated with HIV infection, such as smoking and substance use."
What should I do if I skip one or two doses?,"If you miss one or two doses of your medication, take it as soon as you remember. Do not take more than one dose in one day. If it has been more than 8 hours since you were supposed to take your medication, skip that dose and take the next one at the usual time."
What is the best way to identify the optimal antiretroviral therapy combination for my situation?,"The best way to identify the optimal antiretroviral therapy combination for your situation is to consult with your healthcare provider. They will consider factors such as your viral load, CD4 count, drug resistance, and potential side effects to determine the best treatment plan for you. It is important to adhere to your treatment plan as closely as possible to achieve optimal health outcomes."
What kinds of medications are available for treating malaria?,Malaria is treated with antimalarial drugs. The World Health Organization (WHO) recommends artemisinin-based combination therapies (ACTs) as the first-line treatment for uncomplicated malaria. ACTs contain an artemisinin derivative and a partner drug.
Is it possible to change healthcare providers while undergoing antiretroviral therapy?,"Yes, it is possible to change healthcare providers while undergoing antiretroviral therapy. However, it is recommended to consult with your current healthcare provider or an HIV specialist before doing so, as they can provide guidance on how to transfer your medical records and ensure a smooth transition to your new provider. It is also important to choose a new provider who is knowledgeable about HIV and ART, as this will help ensure that you receive the best possible care."
"Is it safe for me to consume Fanta, Sprite, and non-alcoholic wine?","There is no evidence that consuming Fanta, Sprite, or non-alcoholic wine can directly affect the body's ability to control HIV. However, it is important to maintain a balanced diet and avoid excessive consumption of sugar-sweetened beverages due to their potential negative health effects. If you have any concerns, it is always a good idea to consult with your healthcare provider."
When should a person begin ART treatment?,"The World Health Organization (WHO) recommends that all people living with HIV should begin ART treatment as soon as possible after diagnosis, regardless of their CD4 cell count. Early initiation of ART can help to reduce the risk of HIV transmission, improve health outcomes, and reduce the risk of developing drug resistance. The specific timing of ART initiation should be determined by a healthcare provider taking into account the individual's clinical status, treatment preferences, and other factors."
How does HIV affect hair health?,"HIV infection can cause hair loss due to the effects of HIV on the immune system and the development of opportunistic infections. HIV can also cause hair loss by affecting the hormones that regulate hair growth. It is important to note that hair loss is not a sign of HIV infection, and there are many other causes of hair loss."
In what ways does HIV impact the body?,"HIV impacts the body by interfering with the immune system, specifically the CD4+ T cells, which are responsible for fighting infections. This leads to a weakened immune system, making people living with HIV more susceptible to opportunistic infections. HIV also causes a range of other health problems, including neurological, cardiovascular, and renal diseases."
Should I adhere to a specific diet when taking antiretroviral medications?,"There is no need to follow a specific diet while taking antiretroviral medications, unless you have other health conditions that require certain dietary restrictions. A balanced diet with a variety of fruits, vegetables, lean proteins, and whole grains is recommended for everyone, including people living with HIV. It is also important to maintain a healthy weight, as being overweight or obese can negatively impact HIV treatment outcomes."
At what point does lymphoma develop in individuals with HIV?,"Lymphoma can develop at any stage of HIV infection, but it is more common in patients with advanced immunosuppression. The median CD4 count at the time of diagnosis of HIV-associated lymphoma is typically below 100 cells/mm3. The risk of developing lymphoma increases as the CD4 count decreases."
Is it possible for witchcraft or spirits to play a role in the spread of HIV in Africa?,"No, there is no scientific evidence to support the idea that witchcraft or spirits play a role in the spread of HIV in Africa. HIV is caused by a specific virus, and it is not possible for it to be transmitted by supernatural means. It is important to rely on scientific evidence and to avoid beliefs that are not supported by facts."
Is it safe for me to use ARV medications if I have additional health issues?,"Yes, it is safe to use ARV medications even if you have other health issues. However, it is important to inform your doctor about all your health conditions and medications you are taking, as this can help to avoid drug interactions and ensure the best possible outcomes for your health. It is also important to follow the instructions of your doctor and take your ARV medications as prescribed."
What steps should I take if I accidentally have unprotected sex with my HIV-negative partner?,"If you accidentally have unprotected sex with your HIV-negative partner, it is essential to take immediate action. First, you should consult with your healthcare provider about post-exposure prophylaxis (PEP) as soon as possible. Second, you should get tested for HIV as soon as possible to determine if you are infected. Third, it is crucial to encourage your partner to get tested for HIV as well."
Is it possible to contract HIV from using someone else's water bottle?,"No, HIV cannot be transmitted through the use of someone else's water bottle or any other object that has been used by someone with HIV. HIV is a virus that attacks human immune cells and cannot survive outside the body for long periods of time. It is also important to note that HIV is not transmitted through casual contact, such as shaking hands or hugging."
Can ARV medications be safely used alongside other drugs?,"Yes, ARV medications can be safely used alongside other drugs, including contraceptives, unless otherwise indicated. However, it is important to consult with a healthcare provider or pharmacist to determine if there are any potential interactions between the drugs."
How do HIV and AIDS differ from each other?,"HIV is a virus that attacks the body’s immune system, while AIDS is a disease that results from the prolonged damage of the immune system by HIV. HIV is the virus that causes AIDS, but not everyone who is infected with HIV will develop AIDS. Most people infected with HIV will live a long and healthy life."
"If I missed taking my medication for one day, can I resume using it the next day?","Yes, you can resume taking your medication the next day. However, it is important to take the missed doses as soon as you remember, unless it is almost time for your next scheduled dose. If you have missed more than one dose, it is recommended to contact your healthcare provider for further guidance."
I'm experiencing thoughts of self-harm; what steps can I take to find help?,"I'm sorry to hear that. If you're feeling suicidal, it's important to reach out to someone right away. You can call the Trevor Lifeline at 1-866-4-U-TREVOR (866-487-3826) or the National Suicide Prevention Lifeline at 1-800-662-HELP (800-662-4357). If you're not comfortable talking, you can also text HOME to 741741. It's also important to talk to your healthcare provider or a trusted friend or family member about how you're feeling. Remember, there are people who care about you and want to help."
In what ways can HIV impact my blood sugar levels?,"HIV can impact your blood sugar levels in several ways. First, HIV can directly damage the pancreas, which produces insulin. This can lead to a condition called hyperglycemia, or high blood sugar. Second, HIV can make it harder for the body to use the insulin that is produced. This can lead to a condition called diabetes mellitus. Third, some HIV medications can cause or worsen diabetes. It's important to work closely with your healthcare providers to manage your HIV and your blood sugar levels."
What should I do right away if I accidentally take a double dose of my antiretroviral medication?,"If you accidentally take a double dose of your antiretroviral medication, contact your healthcare provider or pharmacist as soon as possible. Do not take any additional medication. If it is after usual working hours, contact your local poison control center."
Is HIV present in countries outside of here?,"HIV is a global pandemic and is present in many countries outside of the United States. It is estimated that 37.7 million people worldwide are living with HIV, with the majority of cases located in sub-Saharan Africa. It is important to practice safe sex and take precautions when traveling to areas with a high prevalence of HIV."
How does nutrition affect individuals with HIV?,"Nutrition is an essential component of care for people living with HIV (PLHIV). Adequate nutrition can help PLHIV maintain a healthy weight, manage symptoms, and improve quality of life. Eating a balanced diet with adequate calories, protein, vitamins, and minerals is important for PLHIV to maintain their health and manage their condition effectively."
In what ways can HIV impact an individual's digestive system?,"HIV can affect the digestive system in several ways, including causing oral thrush, hairy leukoplakia, and yeast infections in the esophagus. It can also lead to malabsorption of nutrients, diarrhea, and weight loss. Additionally, HIV can cause damage to the pancreas and liver, which can result in pancreatitis and liver disease."
Are there specific foods I should consume to enhance my immune system?,"There is no scientific evidence to support the claim that certain foods can enhance the immune system. A balanced diet that includes a variety of fruits, vegetables, lean proteins, and whole grains can provide the nutrients needed to support immune function. It is important to maintain a healthy diet and lifestyle, including regular exercise, adequate sleep, and avoiding tobacco and alcohol."
How can I keep the type of medication I'm using private from those around me?,"There are several ways to keep your HIV status and medication private. You can keep your medication in a discreet container, ask a friend to pick up your medication for you, or ask your healthcare provider to mail your medication to you. It's also important to be honest with your healthcare provider about how you are feeling about taking your medication so they can help you find ways to make it easier for you to take it."
What impact does HIV have on a person's eyesight?,"HIV can cause a variety of ocular complications, including opportunistic infections, inflammatory conditions, and neurological disorders. These can lead to vision loss or blindness. Regular eye examinations are recommended for people living with HIV to detect and manage these complications."
Is it possible to contract HIV through getting a tattoo or a piercing?,"No, HIV cannot be transmitted through tattoos or piercings if the equipment is sterile and used only on one person. HIV can only be transmitted through semen, vaginal fluids, blood, and syphilis sores. It is essential to use clean, sterile equipment to avoid HIV transmission."
Can my antiretroviral medication be used to treat malaria?,"No, antiretroviral medications cannot be used to treat malaria. Malaria is caused by a parasite, while HIV is a virus. Antiretroviral medications are specifically designed to target and inhibit viral replication. They are not effective against parasites. It is important to seek appropriate medical care and follow the recommended treatment guidelines for malaria."
How can I prevent my child from experiencing stigma due to my HIV status?,It is important to be open and honest with your child about your HIV status. This will allow them to ask questions and understand the condition. It is also important to provide them with support and resources to help them cope with their feelings and to encourage them to seek professional help if needed.
What are the common signs associated with AIDS?,"The most common signs of AIDS are chronic diarrhea, chronic fever, chronic cough, weight loss, and chronic fatigue. Other signs include recurrent herpes simplex, oral candidiasis, and persistent generalized lymphadenopathy."
"Is it possible for doctors, nurses, or children to contract HIV?","Yes, it is possible for doctors, nurses, or children to contract HIV. The risk of HIV transmission is very low if the proper precautions are taken. This includes wearing gloves, using protective eyewear, and wearing gowns during procedures."
What is the process for conducting HIV counselling?,"HIV counselling is a process that involves an informed discussion between a healthcare provider and a client about HIV, its prevention, and risk reduction. The process typically involves pre-test counselling, HIV testing, post-test counselling, and ongoing support and follow-up. The goal of HIV counselling is to provide individuals with the information and support they need to make informed decisions about their health and to reduce their risk of HIV infection."
Is it possible to contract HIV through a sneeze or cough from a person who has HIV?,"No, HIV cannot be transmitted through a sneeze or cough from a person who has HIV. HIV is transmitted through contact with infected body fluids, such as blood, semen, vaginal fluids, and anal fluids. These fluids can be infectious even when they appear clear and have no smell or visible blood."
How does HIV impact skin health?,"HIV can impact skin health in several ways, including causing skin infections, changes in skin pigmentation, and HIV-related skin cancers. These changes may be related to the immune system's ability to fight off infections, changes in hormone levels, and exposure to certain medications. It is important for people living with HIV to protect their skin from the sun and to seek medical attention for any skin concerns."
Can you explain what PEP is?,"PEP is a medication that can be taken within 72 hours after a possible HIV exposure to prevent the infection. It is most effective when started as soon as possible after the exposure. PEP is not 100% effective, but it can significantly reduce the risk of HIV transmission."
What will happen to me if I stop using drugs completely?,"Stopping drug use can improve your physical and mental health, and reduce the risk of HIV transmission. However, it is important to note that the risk of HIV transmission does not disappear completely. It is also important to have regular HIV tests and seek treatment if you are diagnosed with HIV."
Is it possible to contract HIV by sharing headphones or earphones with someone else?,"No, HIV cannot be transmitted through sharing headphones or earphones. HIV is a virus that attacks the immune system and is transmitted through blood, semen, vaginal fluids, and breast milk. Headphones and earphones do not fall into any of these categories. Therefore, there is no risk of contracting HIV by sharing headphones or earphones."
How can I prevent my friends from accessing my medication?,"It's important to be honest and open about your HIV status with your friends. This will help you feel supported and can prevent misunderstandings. If you're uncomfortable sharing your medication with others, it's okay to set boundaries and ask for privacy. Remember, your friends want to support you and help you manage your HIV."
How can I avoid the development of a drug-resistant virus?,"To avoid the development of a drug-resistant virus, it is important to take your HIV medication as prescribed and follow your doctor’s recommendations. It is also important to communicate with your doctor about any concerns you may have regarding your treatment. Taking your medication as prescribed is the best way to maintain your viral load and prevent the development of resistance."
"Can HIV be transmitted through kissing, potentially leading to infection?","No, HIV cannot be transmitted through saliva. HIV is a blood-borne virus and is not transmitted through saliva, tears, sweat, or urine. HIV can only be transmitted through contact with infected blood, such as through sharing needles, syringes, or other drug-injection equipment, or through sexual contact with an infected person."
"""Individuals with HIV?""","Individuals with HIV are those who have tested positive for the presence of the human immunodeficiency virus (HIV). This virus can be transmitted through sexual contact, the use of contaminated needles or other injectable drugs, from mother to child during pregnancy, childbirth, or breastfeeding, or through the transfusion of contaminated blood. It can lead to acquired immunodeficiency syndrome (AIDS), a disease of the immune system that progressively weakens the body's ability to fight infections and can be fatal if left untreated."
Is witchcraft responsible for causing HIV in Africa?,"No, HIV is not caused by witchcraft. HIV is caused by a virus that is transmitted through unprotected sex, sharing needles, and from mother to child during pregnancy, childbirth, and breastfeeding. Witchcraft is not responsible for causing HIV."
Who should I meet with for my upcoming clinic appointment?,"It is recommended to meet with your primary care physician or HIV specialist for your upcoming clinic appointment. If you have a scheduled lab appointment, you may also meet with a lab technician to draw blood for testing. If you have any other questions or concerns, you can ask your healthcare provider for more information."
