question,answer_llm
What should I do if I run out of my antiretroviral medication?,"If you run out of your antiretroviral medication, it is important to refill your prescription as soon as possible. You can contact your healthcare provider or pharmacist to get a refill. If you are having trouble getting your medication, you can also contact your local HIV clinic or a community-based organization for help."
Can HIV/H impact my liver health?,"HIV infection can cause liver damage, but this is not common. The most common cause of liver damage in people with HIV is hepatitis C virus (HCV) infection. If you have HIV and are concerned about your liver health, it is important to talk to your healthcare provider. They can recommend tests to check your liver function and help you manage any liver damage."
In what ways does HIV influence cholesterol levels in an individual?,"HIV infection can lead to changes in cholesterol levels, including an increase in total cholesterol, low-density lipoprotein (LDL) cholesterol, and triglycerides, and a decrease in high-density lipoprotein (HDL) cholesterol. These changes can increase the risk of cardiovascular disease. The exact mechanism of how HIV infection affects cholesterol levels is not fully understood but may be related to inflammation, oxidative stress, and changes in lipid metabolism."
"Do antiretroviral medications lead to changes in weight, either gain or loss?","Yes, antiretroviral medications can lead to changes in weight. Some antiretroviral medications are associated with weight gain, while others are associated with weight loss. The specific medications and their effects on weight can vary depending on the individual and the specific medications being taken."
Can I switch my antiretroviral medication regimen if I experience side effects?,"Yes, you can switch your antiretroviral medication regimen if you experience side effects. It is important to discuss any concerns about side effects with your healthcare provider so that they can help you find the best treatment for you. They may be able to suggest a different medication or adjust your dosage to help alleviate the side effects you are experiencing."
Is it suitable for adolescents or young adults to take antiretroviral (ARV) medications?,"Yes, it is suitable for adolescents or young adults to take antiretroviral (ARV) medications. However, it is important to monitor for potential side effects and drug interactions. It is also important to follow the recommended dosing guidelines and take the medications as prescribed to achieve the best treatment outcomes."
What approaches can I take to cope with the exhaustion or overwhelm caused by my antiretroviral treatment regimen?,"There are several approaches you can take to cope with the exhaustion or overwhelm caused by your antiretroviral treatment regimen. Firstly, you can try to establish a routine for taking your medication to help you stay organized and on track. Secondly, it may be helpful to break your medication schedule into smaller doses throughout the day to help manage the side effects. Lastly, it is important to communicate with your healthcare provider about how you are feeling and to discuss any changes to your treatment plan that may be necessary."
Is it safe to take antiretroviral medications if I have additional health issues?,"Yes, it is safe to take antiretroviral medications even if you have other health issues. However, it is important to inform your healthcare provider about all the medications you are taking, including over-the-counter and herbal supplements, as they may interact with your antiretroviral medications."
How can I restore my sleep patterns?,"There are several ways to restore your sleep patterns. First, try to establish a regular sleep schedule by going to bed and waking up at the same time every day. Second, create a relaxing bedtime routine to help you fall asleep. Third, make sure your sleep environment is comfortable and conducive to sleep."
Are there any limitations on engaging in sexual activities while taking antiretroviral drugs?,"Antiretroviral drugs do not cause sexual dysfunction in most people living with HIV. However, some medications may cause changes in libido or erectile function. It is essential to discuss any concerns with a healthcare provider to ensure safe and enjoyable sexual experiences."
How long does it typically take to achieve viral suppression after beginning treatment for HIV?,"The time it takes to achieve viral suppression after beginning treatment for HIV varies among individuals. Most people will experience a decrease in viral load within a few weeks of starting treatment, with some experiencing viral suppression within 1 to 2 months. However, it can take up to 12 months for some individuals to achieve viral suppression."
Is it possible for someone with an undetectable viral load to receive a negative test result?,"Yes, an undetectable viral load means that the viral load is below the limit of detection of the test, which is typically around 20 copies/mL. As a result, a person with an undetectable viral load can test negative, even if their viral load is above the limit of detection of the test. It is important to note that a negative test result does not necessarily mean that a person is cured of HIV or cannot transmit the virus."
"How can I obtain my viral load test results, and what steps should I take to receive them?","The steps to obtain your viral load test results may vary depending on your healthcare provider and the country you live in. However, you can generally contact your healthcare provider or visit their office to request your results. It is important to follow up on your results, as they can help you and your healthcare provider manage your HIV treatment. If you have any concerns about your results, you should discuss them with your healthcare provider."
Is it safe for me to share my medication with my partner if we're both taking the same prescription?,"No, it is not safe to share medication with your partner if you both have the same prescription. HIV medications are designed to be taken in a specific manner to ensure the medication is effective and safe for the individual taking it. Sharing medication can lead to the development of resistance in the virus, which can make treatment more difficult and less effective in the future. It is important to communicate with your healthcare provider about your concerns and ask for guidance on how to support your partner's health."
In what ways can H impact an individual's overall well-being?,"HIV infection can have a significant impact on an individual's overall well-being. This can include physical symptoms such as fatigue, weight loss, and difficulty breathing, as well as mental health issues such as depression, anxiety, and post-traumatic stress disorder. It can also lead to social stigma and discrimination, which can further impact an individual's quality of life."
How can I lower or reduce my viral load?,"There are several ways to lower or reduce your viral load, including taking your HIV medication as prescribed, eating a healthy diet, getting enough sleep, exercising regularly, managing stress, and avoiding or managing illnesses. It is important to work closely with your healthcare provider to develop an individualized treatment plan."
"What is causing my dental issues, and how can I improve my weight?",HIV infection can cause dental issues due to changes in saliva composition and increased risk of oral infections. Improving weight can be challenging with HIV due to potential medication side effects and changes in metabolism. It is important to work closely with a healthcare provider to manage both dental and weight concerns.
Is it possible to contract HIV through oral contact with my partner's genitalia?,"No, HIV cannot be transmitted through oral contact with the genital area of an HIV-positive person. HIV is transmitted through semen, vaginal fluids, and blood. However, other sexually transmitted infections (STIs) can be transmitted through oral sex, so it is essential to use protection during oral sex to avoid transmission."
What steps should I take if my medication has been stolen?,"If your HIV medication has been stolen, it is important to report the theft to the police as soon as possible. You should also contact your healthcare provider or pharmacist to let them know that your medication has been stolen. They can help you get refilled prescription and may be able to provide additional support or resources to help you manage your medication in the meantime."
Can antiretroviral medications affect sleep quality or cause insomnia?,"Yes, antiretroviral medications can affect sleep quality or cause insomnia. Some antiretroviral medications, such as protease inhibitors, can cause insomnia as a side effect. Other antiretroviral medications, such as non-nucleoside reverse transcriptase inhibitors, can cause changes in sleep architecture, such as increased sleep latency and reduced sleep efficiency. It is important for people living with HIV to communicate with their healthcare providers about any sleep disturbances they are experiencing to determine the best course of action."
Can HIV lead to mental confusion?,"HIV infection can cause mental confusion, also known as HIV-associated neurocognitive disorder (HAND). This can affect thinking, memory, and other cognitive functions. The severity of HAND can range from mild to severe."
Are people with HIV incapable of maintaining healthy relationships?,"No, people with HIV can have healthy relationships. HIV infection does not define a person's value or their ability to form and maintain healthy relationships. People with HIV can have safe and fulfilling relationships and intimate lives."
Do individuals with HIV spread the virus because they don't take precautions?,"Individuals with HIV can spread the virus through sexual contact, sharing needles, or from mother to child during pregnancy, childbirth, and breastfeeding. However, with proper treatment, an HIV-positive person cannot spread the virus sexually."
Is it true that people on ARV medication are unproductive at work?,"No, this is not true. With proper adherence to ARV medication, people living with HIV can lead healthy and productive lives. ARV medication can help prevent the progression of HIV and the development of AIDS, which can lead to severe health complications and disability. It is important to create a supportive work environment for people living with HIV to ensure that they can access the care they need and continue to contribute to the workforce."
Do people living with HIV choose not to disclose their status to avoid responsibility?,"No, people living with HIV do not choose not to disclose their status due to avoidance of responsibility. Non-disclosure is often due to fear of negative consequences, such as stigma and discrimination. It is important for people living with HIV to disclose their status to their partners and healthcare providers to ensure they receive the best care and support."
Is HIV only a problem for people in low-income communities?,"No, HIV is not only a problem for people in low-income communities. HIV affects people of all socioeconomic levels, including high-income communities. However, the prevalence of HIV is often higher in low-income communities due to various social and economic factors."
Do people who travel frequently spread HIV to different regions?,"No, people who travel frequently do not spread HIV to different regions. HIV is not spread through casual contact or through the air. It is spread through body fluids, such as blood, semen, vaginal fluids, and breast milk. It is a common misconception that HIV can be spread through casual contact, such as shaking hands or hugging, or through the air."
Are individuals with HIV irresponsible in taking medication regularly?,"No, individuals with HIV are not inherently irresponsible. HIV is a chronic disease that requires lifelong treatment, and missing medications can lead to the development of drug-resistant strains of HIV and treatment failure. It is important to work with healthcare providers to develop a treatment plan that is manageable and sustainable for the individual."
Do people with HIV avoid medical care to hide their condition from others?,"No, people with HIV do not avoid medical care to hide their condition from others. They may, however, delay seeking care due to fear of stigma or discrimination, or due to lack of access to care. It is important to provide support and resources to help people with HIV access the care they need."
Is it true that HIV-positive people are always at fault for their condition?,"No, it is not true that HIV-positive people are always at fault for their condition. HIV is a sexually transmitted infection that can affect anyone who has sex with an infected person or receives blood or blood products from an infected person. It is not a punishment for one's sexuality or behavior."
Are HIV patients a burden on the healthcare system due to their frequent visits?,"No, HIV patients are not a burden on the healthcare system. The cost of HIV treatment is covered by health insurance or government programs. The benefits of HIV treatment far outweigh the costs, as it can improve the quality of life and prolong the life expectancy of patients."
Do individuals with HIV intentionally avoid using protection to infect others?,"No, the majority of people living with HIV do not intentionally infect others. HIV is a chronic disease that requires lifelong treatment and management. The misconception that people with HIV intentionally infect others may have originated from the early days of the HIV epidemic when there was a lack of understanding about the disease and how it is transmitted."
Are people with HIV unable to adopt children due to their health status?,"No, people living with HIV are not barred from adopting children. In the United States, the 1996 Adoption and Safe Families Act (ASFA) and the 2008 Family and Medical Insurance Leave Act (FMLA) prohibit discrimination against HIV-positive individuals in the adoption process. In addition, the World Health Organization (WHO) and the Joint United Nations Programme on HIV/AIDS (UNAIDS) have stated that HIV-positive people are not considered high-risk parents and are capable of providing safe and nurturing environments for their children."
Do individuals with HIV avoid public spaces to prevent judgment?,"No, individuals with HIV should not avoid public spaces due to fear of judgment. HIV is a treatable and manageable condition, and disclosing one's status does not have to come with negative consequences. It is important to normalize HIV and reduce stigma to encourage testing, treatment, and support."
Is it true that people with HIV are unreliable in long-term commitments?,"No, people living with HIV are no more unreliable in long-term commitments than other people. HIV is a treatable and manageable condition. With effective treatment, people with HIV can live long and healthy lives. HIV is not an accurate predictor of a person's reliability."
Are those on ARV therapy more likely to engage in risky behavior?,"No, there is no evidence that ARV therapy increases the likelihood of risky behavior. In fact, ARV therapy has been shown to reduce the risk of HIV transmission. However, it is important to note that ARV therapy does not provide protection against other sexually transmitted infections."
Do individuals with HIV always rely on government support for treatment?,"No, not all individuals with HIV rely on government support for treatment. Many individuals with HIV have health insurance that covers their treatment, and some rely on support from non-governmental organizations or personal savings. The role of government support for treatment varies depending on the country and its healthcare system."
Are people with HIV more likely to spread the virus through reckless behavior?,"No, people with HIV are not more likely to spread the virus through reckless behavior than people without HIV. HIV-positive people can reduce the risk of transmitting the virus to others by taking antiretroviral medication as prescribed, using condoms consistently, and having fewer sexual partners."
Is it true that HIV-positive individuals lack basic health education?,"No, it is a misconception that people living with HIV (PLWH) lack basic health education. Many PLWH have access to health education and support services, which are crucial for their well-being. These services aim to increase knowledge and promote healthy behaviors to improve health outcomes and quality of life for PLWH."
Do people on ARVs live shorter lives despite the treatment?,"No, people on ARVs do not live shorter lives. With early diagnosis and access to ARVs, HIV can be treated as a manageable chronic condition. The life expectancy of people living with HIV (PLWH) on ART is similar to that of people without HIV."
Are individuals with HIV always part of high-risk groups?,"No, not all individuals with HIV are part of high-risk groups. People from all walks of life are affected by HIV, including individuals from monogamous relationships, healthcare workers, and children in daycare. HIV is a sexually transmitted infection, but it can also be transmitted through blood-to-blood contact, such as from mother to child during pregnancy, childbirth, and breastfeeding."
